{
  "$schema": "https://json-schema.org/draft/2020-12/schema",
  "$id": "https://github.com/moe-charm/nekocode-rust/blob/main/schemas/snapshot-v1.schema.json",
  "title": "NekoCode Snapshot v1",
  "type": "object",
  "required": [
    "contract_version",
    "artifact_kind",
    "status",
    "analysis_mode",
    "schema_version",
    "evidence",
    "execution_policy",
    "generated_at",
    "workspace",
    "limitations"
  ],
  "properties": {
    "contract_version": { "const": "snapshot-v1" },
    "artifact_kind": { "const": "snapshot" },
    "status": {
      "enum": [
        "not_run",
        "completed_clean",
        "completed_with_diagnostics",
        "tool_failed",
        "timed_out",
        "output_limited",
        "partial"
      ]
    },
    "analysis_mode": { "enum": ["metadata_only", "cargo_check", "clippy"] },
    "schema_version": { "type": "integer", "minimum": 1 },
    "evidence": {
      "enum": ["tool-confirmed", "semantic-resolved", "syntax-only", "incomplete"]
    },
    "execution_policy": {
      "type": "object",
      "required": [
        "mode",
        "workspace_trust",
        "cargo_registry_network",
        "process_network_isolation",
        "environment",
        "compiler_wrappers",
        "target_directory"
      ],
      "properties": {
        "mode": { "enum": ["metadata_only", "cargo_check", "clippy"] },
        "workspace_trust": { "enum": ["not_required", "required"] },
        "cargo_registry_network": { "enum": ["not_used", "offline"] },
        "process_network_isolation": {
          "enum": ["not_applicable", "not_enforced"]
        },
        "environment": { "enum": ["not_applicable", "allowlist"] },
        "compiler_wrappers": { "enum": ["not_run", "disabled"] },
        "target_directory": { "enum": ["not_used", "dedicated_temp"] }
      },
      "additionalProperties": false
    },
    "generated_at": { "type": "string", "format": "date-time" },
    "workspace": { "type": "object" },
    "diagnostics": {
      "type": ["object", "null"],
      "properties": {
        "producer": { "enum": ["cargo_check", "clippy"] },
        "profile": { "enum": ["cargo_check_v1", "clippy_default_v1"] },
        "producer_version": { "type": ["string", "null"] },
        "comparison_basis": { "$ref": "#/$defs/comparison_basis" }
      },
      "additionalProperties": true
    },
    "canonical_hash": { "type": ["string", "null"] },
    "limitations": { "type": "array", "items": { "type": "string" } },
    "provenance": { "type": "array", "items": { "type": "object" } },
    "omissions": { "type": "array", "items": { "type": "object" } }
  },
  "$defs": {
    "comparison_observation_status": {
      "enum": ["observed", "absent", "unknown"]
    },
    "comparison_basis": {
      "type": "object",
      "required": [
        "workspace_members_sha256",
        "package_set_sha256",
        "package_targets_sha256",
        "feature_definitions_sha256",
        "workspace_inputs_sha256",
        "compiler_config",
        "target_coverage",
        "feature_coverage",
        "toolchain",
        "producer",
        "profile",
        "producer_version",
        "complete"
      ],
      "properties": {
        "workspace_members_sha256": { "type": "string", "minLength": 1 },
        "package_set_sha256": { "type": "string", "minLength": 1 },
        "package_targets_sha256": { "type": "string", "minLength": 1 },
        "feature_definitions_sha256": { "type": "string", "minLength": 1 },
        "workspace_inputs_sha256": { "type": "string", "minLength": 1 },
        "compiler_config": {
          "type": "object",
          "required": ["status", "sha256"],
          "properties": {
            "status": { "$ref": "#/$defs/comparison_observation_status" },
            "sha256": { "type": ["string", "null"] }
          },
          "additionalProperties": false
        },
        "target_coverage": { "type": "string", "minLength": 1 },
        "feature_coverage": { "type": "string", "minLength": 1 },
        "toolchain": {
          "type": "object",
          "required": ["rustc_version", "cargo_version", "host"],
          "properties": {
            "rustc_version": { "type": ["string", "null"] },
            "cargo_version": { "type": ["string", "null"] },
            "host": { "type": ["string", "null"] }
          },
          "additionalProperties": false
        },
        "producer": { "enum": ["cargo_check", "clippy"] },
        "profile": { "enum": ["cargo_check_v1", "clippy_default_v1"] },
        "producer_version": { "type": ["string", "null"] },
        "complete": { "type": "boolean" }
      },
      "additionalProperties": false
    }
  },
  "additionalProperties": true
}
